user,comment,comment_link,comment_id,time,parent_id
crbelaus,I (along with a friend) am working on an Elixir-based built-in error reporting and tracking solution: ,reply?id=41346911&goto=item%3Fid%3D41342017%26p%3D5%2341346911,41346911,1 day ago,41344341
jaronilan,Almost finished a short story I started writing about a year ago. It is about SEO.,reply?id=41343708&goto=item%3Fid%3D41342017%26p%3D4%2341343708,41343708,1 day ago,41343649
eashish93,"Hi guys,
For the past few months, I'm working on a form builder called minform with focus on UX and themes. Current form builders too restricted when comes to styling. It's free for unlimited submissions with paid plan for team feature.",reply?id=41345925&goto=item%3Fid%3D41342017%26p%3D4%2341345925,41345925,1 day ago,41343708
aszantu,"will look into them, stealing ideas!",reply?id=41349565&goto=item%3Fid%3D41342017%26p%3D2%2341349565,41349565,23 hours ago,41345733
tired_and_awake,"I'm a tech exec who misses their physics roots. In my spare time I'm interviewing ""materials manufacturers"" to come up with a viable startup idea. I'm hoping to build a company that leverages simulation and ML to accelerate material discovery.",reply?id=41343028&goto=item%3Fid%3D41342017%26p%3D2%2341343028,41343028,1 day ago,41345733
_bramses,Sure!,reply?id=41350518&goto=item%3Fid%3D41342017%26p%3D1%2341350518,41350518,22 hours ago,41347206
alfredgg,I am working on improving a system to inform citizens about the public benefits for which they are eligible [0]. It's hold by Barcelona City Council.,reply?id=41346620&goto=item%3Fid%3D41342017%26p%3D1%2341346620,41346620,1 day ago,41347206
rprtr258,simple process manager for linux ,reply?id=41348962&goto=item%3Fid%3D41342017%26p%3D5%2341348962,41348962,1 day ago,41346911
jjpell,"I've created a two player wordle style game.
",reply?id=41345433&goto=item%3Fid%3D41342017%26p%3D4%2341345433,41345433,1 day ago,41345925
zulban,I just reprioritzed my remaining 300 or so tickets for my chess variant AI sandbox game ,reply?id=41343683&goto=item%3Fid%3D41342017%26p%3D4%2341343683,41343683,1 day ago,41345433
anshargal,I'm working on QA Sphere ,reply?id=41345454&goto=item%3Fid%3D41342017%26p%3D4%2341345454,41345454,1 day ago,41343683
arichard123,I'm trying to solve loneliness and improve civilisation.,reply?id=41345922&goto=item%3Fid%3D41342017%26p%3D4%2341345922,41345922,1 day ago,41345454
mooneater,"I work for a VC, in case you are seeking funding for your startup, Material Science is interesting to us robin@agfunder.com",reply?id=41343550&goto=item%3Fid%3D41342017%26p%3D2%2341343550,41343550,1 day ago,41343028
elric,"I haven't been working on much at all lately, struggling from bore-out at work. 8 hours of boredom a day is surprisingly exhausting, and it's spilling over into the rest of my life. Starting a new gig next month, hopefully things will pick up again.",reply?id=41345196&goto=item%3Fid%3D41342017%26p%3D1%2341345196,41345196,1 day ago,41346620
allabtai,0ptimizing building apps with an ai stack at ,reply?id=41345232&goto=item%3Fid%3D41342017%26p%3D5%2341345232,41345232,1 day ago,41348962
moridin,Working on an advertising and marketing strategy platform with my brother comprising a series of apps that accelerate workflows and time to insight using AI.,reply?id=41343906&goto=item%3Fid%3D41342017%26p%3D5%2341343906,41343906,1 day ago,41345232
em-bee,what is your approach? please elaborate,reply?id=41348496&goto=item%3Fid%3D41342017%26p%3D4%2341348496,41348496,1 day ago,41345922
icy,"I’ve been thinking/slowly building a service that hosts Kubernetes control planes. Bring your own worker nodes. Users can get a fully managed control plane (upgrades, HA, etc.) in their region of choice and can use whatever workers they want—be it cloud VMs, bare metal or your laptop too.",reply?id=41344881&goto=item%3Fid%3D41342017%26p%3D4%2341344881,41344881,1 day ago,41345922
DavidPiper,"Senior SWE with Comp Sci + Chemical Engineering background, considering a masters in materials science. If you're ever looking for someone who can bridge those spaces, would love to chat. Email etc in bio.",reply?id=41344173&goto=item%3Fid%3D41342017%26p%3D2%2341344173,41344173,1 day ago,41343028
adulion,,reply?id=41347965&goto=item%3Fid%3D41342017%26p%3D2%2341347965,41347965,1 day ago,41343028
maccard,"I had a bit of a tough time towards the end of my last job, and felt a similar ennui. If you can, I’d highly highly recommend picking up a completely unrelated hobby to fill your non work (and occasionally work, when you’re in that limbo) time. I couldn’t believe the effect it had on me, and it meant that I started my new role feeling refreshed and optimistic, rather than just diving into it like I normally do.",reply?id=41345944&goto=item%3Fid%3D41342017%26p%3D1%2341345944,41345944,1 day ago,41345196
michaelleland,"I’m working on building a payroll outsourcing company targeting the construction industry. 2,900 employees paid last week! Deep ERP integration is our competitive edge.",reply?id=41343252&goto=item%3Fid%3D41342017%26p%3D5%2341343252,41343252,1 day ago,41343906
sidcool,Myself. Getting over a burnout and nervous breakdown.,reply?id=41344229&goto=item%3Fid%3D41342017%26p%3D5%2341344229,41344229,1 day ago,41343252
solatic,"Kubernetes is really built on the assumption that workers are in the same LAN as the control plane. Long latency between the control plane and workers affects workload reliability; heartbeats need to be configured with longer timeouts, for example. Pod-to-pod communication, where pods run in regions on opposite sides of the globe, supposedly on the same pod network CIDR, is also going to be flaky. There's a long history of projects attempting to take LAN-local designs and make them resistant to regional failure by superimposing a LAN on top of a WAN and it never works as intended. Furthermore, various service meshes already present ways of helping to direct/shape traffic between clusters (i.e. between regions), when service architecture evolves to truly support multiple regions.",reply?id=41345081&goto=item%3Fid%3D41342017%26p%3D4%2341345081,41345081,1 day ago,41344881
icy,"> Kubernetes is really built on the assumption that workers are in the same LAN as the control plane. Long latency between the control plane and workers affects workload reliability; heartbeats need to be configured with longer timeouts, for example.",reply?id=41345651&goto=item%3Fid%3D41342017%26p%3D4%2341345651,41345651,1 day ago,41344881
dang,(See ,reply?id=41342356&goto=item%3Fid%3D41342017%26p%3D2%2341342356,41342356,1 day ago,41347965
em-bee,"almost 1000 comments suggests that this is very popular. doing this monthly would really help, although people may want to repost, so maybe some rule is needed for that. probably marking a post as ""REPOST"" or ""NEW"" would help regular readers find new projects.",reply?id=41347414&goto=item%3Fid%3D41342017%26p%3D2%2341347414,41347414,1 day ago,41342356
lbrito,Big tech made me feel like that. Hope you feel better at new gig.,reply?id=41348225&goto=item%3Fid%3D41342017%26p%3D1%2341348225,41348225,1 day ago,41345196
kshantanu94,I felt that,reply?id=41345208&goto=item%3Fid%3D41342017%26p%3D1%2341345208,41345208,1 day ago,41345196
dan_manges,"A new CI/CD platform. Local CLI (run without git push), remote debugger, automatic content-based caching, DAG-based definition, and dynamic tasks. It’s taken a lot of work to build it, but I’m really excited about how well it’s working. ",reply?id=41342537&goto=item%3Fid%3D41342017%26p%3D1%2341342537,41342537,1 day ago,41345196
stefantheard,"I'm trying a productized service model for devops (pylonops.com) and working on a community platform for moms with my wife (no URL yet, but soon!)",reply?id=41343688&goto=item%3Fid%3D41342017%26p%3D5%2341343688,41343688,1 day ago,41344229
kirubakaran,Improved the search feature of ,reply?id=41342659&goto=item%3Fid%3D41342017%26p%3D5%2341342659,41342659,1 day ago,41343688
jasondigitized,Building a word game for my mom: ,reply?id=41343871&goto=item%3Fid%3D41342017%26p%3D5%2341343871,41343871,1 day ago,41342659
opendomain,I am working on a new type of NFTs.,reply?id=41344359&goto=item%3Fid%3D41342017%26p%3D4%2341344359,41344359,1 day ago,41344881
sumeruchat, - Just started this as a side project a few days ago but the goal is to get AI to generate a proper newspaper while striving to eliminate editorial bias,reply?id=41342606&goto=item%3Fid%3D41342017%26p%3D4%2341342606,41342606,1 day ago,41344359
ukuina,"Nice, I was very interested in this space after launching ",reply?id=41345711&goto=item%3Fid%3D41342017%26p%3D4%2341345711,41345711,1 day ago,41342606
hollerith,"Adding ""REPOST"" or ""NEW"" does nothing to ameliorate the problem of the same comment occurring over and over in search results (particularly hn.algolia.com/?sort=byDate searches).",reply?id=41347430&goto=item%3Fid%3D41342017%26p%3D2%2341347430,41347430,1 day ago,41342356
em-bee,"fair point, but i think linking to the original post would make it more difficult to scan though the page, and people would simply not read those posts. might as well ban reposts altogether. so i think if reposts make sense then a tag is better than a link. if links are used they would at least need a short description, so for those that wrote a more detailed post at first, a link with a short desctiption would make sense, but that would benefit from a tag as well.",reply?id=41347543&goto=item%3Fid%3D41342017%26p%3D2%2341347543,41347543,1 day ago,41342356
gabigrin,"Hello!
I'm working on a low-code API builder based on Flyde, the open-source visual programming language I launched a few months ago (",reply?id=41344833&goto=item%3Fid%3D41342017%26p%3D2%2341344833,41344833,1 day ago,41342356
Mavvie,"I haven't tried this yet, but I wanted to say I think there's a lot of potential in this space. There's so much friction with the current popular solutions...and yet it's so hard to justify trying some of the newer and less popular ones.",reply?id=41342738&goto=item%3Fid%3D41342017%26p%3D1%2341342738,41342738,1 day ago,41342537
rtpg,This seems really neat! I'm a huge proponent of incremental CI for any project that gets big enough to care about test speed.,reply?id=41346523&goto=item%3Fid%3D41342017%26p%3D1%2341346523,41346523,1 day ago,41342537
boogieknite,Apple vision pro app for documenting realtor's pre-listing-checklist notes in space and then also exporting notes to LMS-required PDFs for submission.,reply?id=41343227&goto=item%3Fid%3D41342017%26p%3D5%2341343227,41343227,1 day ago,41343871
sumeruchat,Thanks I had this idea for a while but only with the new gpt models I think its executable now. Is there a market for this? Either way fun project and I will generate a newspaper in 90s style everyday,reply?id=41347867&goto=item%3Fid%3D41342017%26p%3D4%2341347867,41347867,1 day ago,41342606
jcpst,I had surgery for a torn meniscus repair. I’m on the couch for a least another month.,reply?id=41342924&goto=item%3Fid%3D41342017%26p%3D2%2341342924,41342924,1 day ago,41344833
Bnjoroge,how does it compare with dagger?,reply?id=41342544&goto=item%3Fid%3D41342017%26p%3D1%2341342544,41342544,1 day ago,41342537
novaleaf,"godot csharp (C#) game engine tech / middleware.   If you are in the seattle area or want to collab on hobby stuff with questionable financial upside, ping me.",reply?id=41350885&goto=item%3Fid%3D41342017%26p%3D5%2341350885,41350885,21 hours ago,41343227
palk,I'm working on an end-to-end encrypted alternative to Google Forms (because Google is creepy).,reply?id=41344997&goto=item%3Fid%3D41342017%26p%3D5%2341344997,41344997,1 day ago,41350885
ukuina,"It is a fun project to build for yourself, but I could not figure out a viable monetization path.",reply?id=41348963&goto=item%3Fid%3D41342017%26p%3D4%2341348963,41348963,1 day ago,41342606
jmcgough,"AI news seems kind of harmful - it can't do investigative journalism, so it's taking the hard work others have done and rewording it, right?",reply?id=41343185&goto=item%3Fid%3D41342017%26p%3D4%2341343185,41343185,1 day ago,41342606
AstroJetson,"Piling on the ""Do the Physical Therapy"" train, I had this done 2 years ago, did the PT work and now back 100%.  It's a pain (literally and figuratively) but future you will be super happy current you did the work.  Look into chair yoga, it will help you keep all of the other bits stretched out.  Good luck!",reply?id=41346988&goto=item%3Fid%3D41342017%26p%3D2%2341346988,41346988,1 day ago,41342924
foreigner,"I had this done when I was 16. Be sure to finish the whole physical therapy regime, even after your knee feels normal again!",reply?id=41345707&goto=item%3Fid%3D41342017%26p%3D2%2341345707,41345707,1 day ago,41342924
amir734jj,"I like the idea, but I have used Azure Pipelines, and the key differentiating it from GitLab.ci is its ""service connection"" that enables seamless integration with third-party services and a wide range of tasks (PowerShell, pscore, az, docker, etc).",reply?id=41344123&goto=item%3Fid%3D41342017%26p%3D1%2341344123,41344123,1 day ago,41342537
kaspermarstal,"I am building an Excel extension that lets me use LLMs in formulas. For example, I can write =PROMPT(A1:E1, ""Extract keywords"") in a cell to extract keywords from a row and drag the cell to apply the prompt to many other rows. I find this useful when I want to use AI for repetitive tasks that would normally require copy-pasting data in and out of a chat window many times.",reply?id=41344727&goto=item%3Fid%3D41342017%26p%3D1%2341344727,41344727,1 day ago,41342537
mft_,"Huh, I was googling for this exact tool a couple of weeks ago.",reply?id=41348400&goto=item%3Fid%3D41342017%26p%3D1%2341348400,41348400,1 day ago,41344727
Who_99,"I am working on turning my theory into a code. I have a theory on how the brain works. Do not criticize me, even i know how it sounds.",reply?id=41343961&goto=item%3Fid%3D41342017%26p%3D5%2341343961,41343961,1 day ago,41344997
theendisney4,Makes me wonder what and how many projects and theories there are that one probably shouldnt bother to mention.,reply?id=41344508&goto=item%3Fid%3D41342017%26p%3D5%2341344508,41344508,1 day ago,41343961
underbooter,Congratulations.,reply?id=41345256&goto=item%3Fid%3D41342017%26p%3D5%2341345256,41345256,1 day ago,41343961
scottmckenzie,I’m a software engineer looking for problems to solve…,reply?id=41342915&goto=item%3Fid%3D41342017%26p%3D5%2341342915,41342915,1 day ago,41343961
research_pie,Currently studying the segment anything model family (1 and 2 & everything in-between).,reply?id=41342673&goto=item%3Fid%3D41342017%26p%3D5%2341342673,41342673,1 day ago,41342915
sumeruchat,Its going to take in info from all the internet and summarize it in a factual way.,reply?id=41345018&goto=item%3Fid%3D41342017%26p%3D4%2341345018,41345018,1 day ago,41342606
gnastygnorc,I've been working on a pretty basic who's that pokemon game for a little while. There's quite a few online but none quite scratched the itch for me.,reply?id=41346858&goto=item%3Fid%3D41342017%26p%3D4%2341346858,41346858,1 day ago,41342606
brennerm,Currently working solo on the MVP of ,reply?id=41346354&goto=item%3Fid%3D41342017%26p%3D4%2341346354,41346354,1 day ago,41346858
lemonwaterlime,Working on a SaaS that associates a person/company and their tech stack with psychology profiles. The intent is to better connect job seekers with companies.,reply?id=41343693&goto=item%3Fid%3D41342017%26p%3D2%2341343693,41343693,1 day ago,41342924
tillcarlos,Awesome idea. Like a stackshare combined with a job board?,reply?id=41343944&goto=item%3Fid%3D41342017%26p%3D2%2341343944,41343944,1 day ago,41343693
ayewo,Were you thinking of Key Values ,reply?id=41347198&goto=item%3Fid%3D41342017%26p%3D2%2341347198,41347198,1 day ago,41343693
CarpeQueso,"I just started working on an engine for turn-based table-top games like Dominion, 7 Wonders, Catan, etc.",reply?id=41346679&goto=item%3Fid%3D41342017%26p%3D2%2341346679,41346679,1 day ago,41343693
kaspermarstal,What’s your use case?,reply?id=41357914&goto=item%3Fid%3D41342017%26p%3D1%2341357914,41357914,2 hours ago,41344727
burnt_toast,A desktop app for analyzing Node.js heap dumps. I've had to hunt down some for work and I feel like the tooling could be improved.,reply?id=41343494&goto=item%3Fid%3D41342017%26p%3D5%2341343494,41343494,1 day ago,41342673
markles,I've been learning io_uring for fun and 0 profit by building a web-based game using only the Rust standard library. I create a simple WebSocket server and am now creating async from the ground up. I'm documenting it all: ,reply?id=41346488&goto=item%3Fid%3D41342017%26p%3D4%2341346488,41346488,1 day ago,41346354
goldfeld,"So I have started creating a new keyboard layout based on Dvorak; but more a text generation and expansion engine, with snippets or abbreviations in vim.",reply?id=41350656&goto=item%3Fid%3D41342017%26p%3D2%2341350656,41350656,21 hours ago,41346679
kaspermarstal,"Yes I am really interested in good use-cases, send me an e-mail at kaspermarstal@gmail.com!  It’s called Cellm, implemented with ExcelDna and is fully functional for Anthropic models. Currently preparing the repo for public release and writing some docs.",reply?id=41349592&goto=item%3Fid%3D41342017%26p%3D1%2341349592,41349592,23 hours ago,41344727
yu3zhou4,"High impact project with a promise for enterprise clients, good luck!",reply?id=41345507&goto=item%3Fid%3D41342017%26p%3D1%2341345507,41345507,1 day ago,41344727
ChicagoDave,Interactive Fiction authoring platform (sharpee) built in C# 8 and mostly coded iteratively using Claude Sonnet 3.5.,reply?id=41344391&goto=item%3Fid%3D41342017%26p%3D5%2341344391,41344391,1 day ago,41343494
twoperkg,I am still working on ,reply?id=41344399&goto=item%3Fid%3D41342017%26p%3D5%2341344399,41344399,1 day ago,41344391
ckugblenu,"I've been working on BatchWizard, a CLI tool for managing OpenAI batch processing jobs. It lets you easily upload files, create batch jobs, check status, and download results - all from the command line. Handles multiple jobs concurrently with async processing. I built it to simplify working with OpenAI's batch APIs.
Check it out on GitHub if you're interested: ",reply?id=41344610&goto=item%3Fid%3D41342017%26p%3D4%2341344610,41344610,1 day ago,41346488
Igor_Wiwi,Get another word - ,reply?id=41345780&goto=item%3Fid%3D41342017%26p%3D4%2341345780,41345780,1 day ago,41344610
vax425,"I’m boxing up LunaKrons to get ahead of this year’s gifting rush, and I’m really pleased with how the packaging is turning out.",reply?id=41347411&goto=item%3Fid%3D41342017%26p%3D4%2341347411,41347411,1 day ago,41345780
ralphc,I'm one of the people working on Prodigy Reloaded (,reply?id=41344292&goto=item%3Fid%3D41342017%26p%3D2%2341344292,41344292,1 day ago,41350656
chrisstanchak,Web interface as well? Prodigy was great.,reply?id=41344304&goto=item%3Fid%3D41342017%26p%3D2%2341344304,41344304,1 day ago,41344292
ralphc,"The Prodigy PC client runs in Dosbox, it's how we do most of our testing. If we, or someone, can get dosbox working in a browser then it's possible. But when it's displayed at vintage computer festivals period-appropriate hardware is used.",reply?id=41349431&goto=item%3Fid%3D41342017%26p%3D2%2341349431,41349431,23 hours ago,41344292
kaspermarstal,Thanks!,reply?id=41349494&goto=item%3Fid%3D41342017%26p%3D1%2341349494,41349494,23 hours ago,41344727
8organicbits,The recent relicensing of Redis to a non-open-source license bothered many in the community. But the groundwork for the relicensing was laid much earlier. I've been working on relicensing monitor to track various projects attributes that can affect the ease of relicensing a project.,reply?id=41342968&goto=item%3Fid%3D41342017%26p%3D1%2341342968,41342968,1 day ago,41344727
k2m,Wanted to say this is a very cool app. I use it all the time to capture information from images. Nice to meet you!,reply?id=41344449&goto=item%3Fid%3D41342017%26p%3D5%2341344449,41344449,1 day ago,41344399
twoperkg,Thank you so much for the kind words about TextSniper! I'm really glad to hear you find it useful and use it frequently. It's always rewarding to know the app is helping people in their day-to-day work.,reply?id=41349525&goto=item%3Fid%3D41342017%26p%3D5%2341349525,41349525,23 hours ago,41344399
a1o,Still slowly working on AGS. There's a lot to do and I don't have as much time as I used but still doing contributions to it.,reply?id=41342767&goto=item%3Fid%3D41342017%26p%3D5%2341342767,41342767,1 day ago,41344399
pdyc,,reply?id=41344660&goto=item%3Fid%3D41342017%26p%3D4%2341344660,41344660,1 day ago,41347411
zoltrix303,Jobchef.io is a SaaS I've worked on for a little while and recently released.,reply?id=41346157&goto=item%3Fid%3D41342017%26p%3D4%2341346157,41346157,1 day ago,41344660
ljhsiung,I'd like to work on my writing skills. Some mix of nerdiness and personal Journaling. ,reply?id=41343579&goto=item%3Fid%3D41342017%26p%3D2%2341343579,41343579,1 day ago,41344292
justanotherjoe,I find when I'm swamped it's because I lack decision making skills.  It's a soft skill to keep your workload manageable.  There's no substitute to constantly making decisions.  And I suspect is the key to being a 10x developer (besides being smart),reply?id=41347649&goto=item%3Fid%3D41342017%26p%3D2%2341347649,41347649,1 day ago,41343579
jeeyoungk,"I also think CLAs are eerie and goes against the open source spirit, I don't think CLA alone puts a project in ""high risk"". I'm not sure about the FAANG open source projects that are used as libraries (Guava, React, ...). These projects fundamentally don't jeopardize these company's businesses, and serve to increase the developer goodwill amongst the engineers. Nobody can predict the future but I can't imagine these projects becoming relicensed.",reply?id=41343206&goto=item%3Fid%3D41342017%26p%3D1%2341343206,41343206,1 day ago,41342968
Cereal,"I'm working on a TUI application which allows you to make SQL query on CSV files.
I'm working on a web base version too.",reply?id=41343114&goto=item%3Fid%3D41342017%26p%3D5%2341343114,41343114,1 day ago,41342767
traviskuhl," -- Open Source platform for producing, hosting and monetizing video & audio podcasts through subscriptions, ads or one-time payments.",reply?id=41342623&goto=item%3Fid%3D41342017%26p%3D4%2341342623,41342623,1 day ago,41346157
kmoser,"Over-researching is probably better than under-researching. To reduce time spent researching, try imposing a deadline. The difficulty will be sticking to it, since nobody but yourself will be breathing down your neck.",reply?id=41343799&goto=item%3Fid%3D41342017%26p%3D2%2341343799,41343799,1 day ago,41343579
8organicbits,"Agreed, and there's a few projects with CLAs that are ranked lower due to mitigating factors, like K8s [1]. I honestly don't get why they have a CLA, anyone know?",reply?id=41343829&goto=item%3Fid%3D41342017%26p%3D1%2341343829,41343829,1 day ago,41342968
em-bee,do you consider the likelyhood that a project will be forked?,reply?id=41347370&goto=item%3Fid%3D41342017%26p%3D1%2341347370,41347370,1 day ago,41342968
willhackett,,reply?id=41344195&goto=item%3Fid%3D41342017%26p%3D5%2341344195,41344195,1 day ago,41343114
s3arch,Making android based TV consoles to play top Android games using key mapper mapping from touch to gamepad.,reply?id=41344384&goto=item%3Fid%3D41342017%26p%3D5%2341344384,41344384,1 day ago,41344195
briansm,"Experiments with speech compression/processing. The modern approach to this (and pretty much everything else) is to transform the input data into a high-dimensional space, throw it into a neural net and cross your fingers. (the 'Whisper' STT runs in 512-dimensional space!). It works, but it's hardly elegant or compute-efficient. There's a certain art in doing things the 'old way', even if a million years of evolution decided neural-nets were the one true path.",reply?id=41344551&goto=item%3Fid%3D41342017%26p%3D4%2341344551,41344551,1 day ago,41342623
rojasdiego,Is there a place where one can get familiar with your work on this?,reply?id=41344559&goto=item%3Fid%3D41342017%26p%3D4%2341344559,41344559,1 day ago,41344551
michaelsalim,"Open source presenter software. The idea is anything you want to show on screen, all can be controlled through a single page. Useful for any events like concert, conference, camps, etc. You can also use it for digital signage.",reply?id=41342605&goto=item%3Fid%3D41342017%26p%3D2%2341342605,41342605,1 day ago,41343579
minajevs,I am working on an ,reply?id=41345789&goto=item%3Fid%3D41342017%26p%3D2%2341345789,41345789,1 day ago,41342605
jfil,Working on:,reply?id=41347856&goto=item%3Fid%3D41342017%26p%3D2%2341347856,41347856,1 day ago,41345789
8organicbits,What happens after the relicensing isn't measured as the community has already been disrupted. I'm also less certain on how to fairly measure and predict fork likelihood.,reply?id=41351907&goto=item%3Fid%3D41342017%26p%3D1%2341351907,41351907,19 hours ago,41342968
b2p,,reply?id=41343668&goto=item%3Fid%3D41342017%26p%3D5%2341343668,41343668,1 day ago,41344384
briansm,"God no, the internet SNR is low enough as it is without all my failed experiments, lol.",reply?id=41344755&goto=item%3Fid%3D41342017%26p%3D4%2341344755,41344755,1 day ago,41344551
mertbio,Recently released an iOS that helps you to see your Plausible Analytics data on the widgets: ,reply?id=41342431&goto=item%3Fid%3D41342017%26p%3D4%2341342431,41342431,1 day ago,41344551
jfil,Ideas:,reply?id=41349089&goto=item%3Fid%3D41342017%26p%3D2%2341349089,41349089,1 day ago,41347856
lbrito,"Ooo, that is interesting. There was a website that kind of did that, but you could only compare single items at any given time, which kind of defeats the purpose (if it is to save money).",reply?id=41348212&goto=item%3Fid%3D41342017%26p%3D2%2341348212,41348212,1 day ago,41347856
